{
  "case_dir": "/work/cavity",
  "created_at": "2026-06-29T22:54:18Z",
  "files": [
    {
      "path": "inputs/system/controlDict",
      "sha256": "0000000000000000000000000000000000000000000000000000000000000000",
      "size": 128
    }
  ],
  "format": "ofti.snapshot",
  "format_version": 1,
  "reason": "parallel-resize",
  "roots": [
    "system",
    "constant",
    "0"
  ]
}
